{
    "id": "vehicle_motorcycle",
    "version": "1.0.0",
    "type": "primitive",
    "category": "vehicle",
    "name": "Motocicletta",
    "description": "Motocicletta a due ruote, vista dall'alto",
    "tags": [
        "moto",
        "veicolo",
        "due-ruote"
    ],
    "propsSchema": {
        "type": "object",
        "properties": {
            "color": {
                "type": "string",
                "default": "#ef4444"
            }
        }
    },
    "defaultProps": {
        "color": "#ef4444"
    },
    "render": {
        "svg": "<g><ellipse cx='0' cy='0' rx='1.5' ry='4' fill='{color}' stroke='#000' stroke-width='0.2'/><circle cx='0' cy='-3' r='0.8' fill='#1f2937'/><circle cx='0' cy='3' r='0.8' fill='#1f2937'/></g>"
    }
}