{
    "id": "vehicle_sedan",
    "version": "1.0.0",
    "type": "primitive",
    "category": "vehicle",
    "name": "Auto Berlina",
    "description": "Auto berlina standard a 4 porte, vista dall'alto. Usare per veicoli passeggeri normali.",
    "tags": [
        "auto",
        "veicolo",
        "passeggeri"
    ],
    "propsSchema": {
        "type": "object",
        "properties": {
            "color": {
                "type": "string",
                "default": "#3b82f6"
            },
            "headlights": {
                "type": "boolean",
                "default": false
            }
        }
    },
    "defaultProps": {
        "color": "#3b82f6",
        "headlights": false
    },
    "render": {
        "svg": "<g><rect x='-3' y='-5' width='6' height='10' fill='{color}' stroke='#000' stroke-width='0.3' rx='0.5'/><rect x='-2' y='-3' width='4' height='2' fill='#1e40af' opacity='0.3'/><rect x='-2' y='1' width='4' height='2' fill='#1e40af' opacity='0.3'/><circle cx='0' cy='-4' r='0.5' fill='{headlights ? \"#fef08a\" : \"#666\"}'/><circle cx='0' cy='4' r='0.4' fill='#dc2626'/></g>"
    }
}